{"schemaVersion":1,"scopeSummary":"Pinned feature-final change for PR #67 from 10e54a08ddfa0815bb8d4d2ae393f7c0c7ae2602 to 1eac7ee5564b48cfccad37c9d04106888d522aa4: repository-activated Whiteboard Defense plugin, digest-bound interactive artifact, generic isolated agent-workflow runtime, Codex and Claude Code adapters, Desktop and CLI integration, multi-plugin packaging, and Judge v2 isolation upgrade. The digest-bound Verification artifact reports broad PASS coverage, clean-checkout CI, provider smokes, generated-artifact validation, and known external Homebrew cask pre-release failure.","complexity":"nontrivial","challenges":[{"id":"chg-001","prompt":"What exactly changed in the module graph and gate lifecycle, and which pre-existing gate responsibilities intentionally remain unchanged after adding Whiteboard Defense and Judge v2?","rationale":"The verification artifact claims R1 and R8 pass, but it summarizes outcomes rather than forcing a precise separation between new Whiteboard behavior, upgraded Judge isolation, existing Verification/Judge responsibilities, and unchanged finalization semantics.","pushHarder":[{"id":"chg-001-ph1","prompt":"Where is the line between Whiteboard PASS, Judge PASS, and Verification PASS, and what evidence proves the implementation does not let those meanings collapse into one another?","rationale":"The feature deliberately ships two related agent gates in one PR; a credible review should pressure-test whether their contracts remain separate rather than merely separately named."}]},{"id":"chg-002","prompt":"Walk through the control flow from an active PR boundary attempt to an automatically recorded Whiteboard outcome, including eligibility selection, preparation, stage execution, evaluation, artifact publication, and final outcome recording.","rationale":"Verification reports scheduler, runtime, and final recheck tests, but it does not itself show the full sequence or where each fail-closed decision occurs.","pushHarder":[{"id":"chg-002-ph1","prompt":"At which exact points can the workflow return UNSET/Unavailable instead of PASS or FAIL, and what prevents a partial stage result from being recorded as a governed gate outcome?","rationale":"The acceptance criteria distinguish execution unavailability from artifact failure; this distinction is easy to blur in a multi-step automated scheduler."}]},{"id":"chg-003","prompt":"How does the implementation distinguish ordering-only `after` edges from evidence-bearing `dependsOn` edges for Whiteboard, especially when Judge is enabled, disabled, stale, failed, or unavailable?","rationale":"The decisions and verification artifact claim Judge is conditional ordering only and not Whiteboard input, but the exact data-flow boundary is central to AC1, AC3, and AC8.","pushHarder":[{"id":"chg-003-ph1","prompt":"What evidence would show that a current Judge artifact can delay Whiteboard without being included in the Challenger or Defender/Publisher prompt envelope?","rationale":"The strongest risk is an ordering dependency accidentally becoming an evidence dependency through shared boundary preparation code."}]},{"id":"chg-004","prompt":"How is the pinned evaluation scope computed for ordinary slice boundaries versus feature-final boundaries, and what prevents the Whiteboard or Judge input from drifting outside the pinned range?","rationale":"Verification claims feature-final range pinning and changed-input invalidation, while the input packet shows feature and slice base handling plus externalized patch sidecars. The challenge should test the exact scope math and freshness proof.","pushHarder":[{"id":"chg-004-ph1","prompt":"For this single-PR feature-final case where the feature base and slice base match, what changed about duplicate patch handling, and what behavior remains required when they do not match?","rationale":"The decisions mention deduplicating identical patches and preserving both inventories; that optimization must not redefine multi-slice feature-final semantics."}]},{"id":"chg-005","prompt":"Describe the data flow of the agent input packet: boundary context, changed-file inventories, externalized patch sidecars, dependency evidence, stage dependencies, and typed outputs.","rationale":"The verification artifact reports bounded prompts and digest-bound sidecars, but it does not show whether a reviewer can reconstruct every data hop from source evidence to stage output.","pushHarder":[{"id":"chg-005-ph1","prompt":"What does the digest of the provider prompt prove, and what does the digest of the read-only snapshot plus sidecar manifest prove that the prompt digest alone cannot?","rationale":"Patch bodies were intentionally moved out of the prompt; the defense must account for the split proof."}]},{"id":"chg-006","prompt":"What is the strongest evidence that Challenger and Defender/Publisher ran in independent fresh contexts with zero inherited implementation conversation, and what remains an adapter/provider assertion rather than an independently observable fact?","rationale":"Verification cites live provider smokes, receipts, context IDs, and zero-inherited-turn attestations, but isolation is partly mediated by provider-specific behavior and local CLI flags.","pushHarder":[{"id":"chg-006-ph1","prompt":"If a provider reports a new context ID but internally reuses hidden conversation state, which part of the current evidence would detect that, and which part would not?","rationale":"The feature’s credibility depends on knowing the boundary between auditable isolation and provider trust."}]},{"id":"chg-007","prompt":"How does the runtime enforce read-only pinned repository access and disposable scratch behavior across Codex, Claude Code, CLI, and Desktop surfaces?","rationale":"Verification says adapters retain read-only isolated-stage contracts, but the repo view shows enforcement is split across snapshot creation, adapter flags, receipt validation, and cleanup.","pushHarder":[{"id":"chg-007-ph1","prompt":"What evidence proves the agent cannot mutate the feature record or developer checkout, as distinct from merely recording `repositoryAccess: read-only-pinned` in the receipt?","rationale":"A receipt policy field is not equivalent to filesystem containment; the defense should identify the actual enforcement boundary."}]},{"id":"chg-008","prompt":"What external contracts were introduced with Codex and Claude Code adapters, including model selection, reasoning effort, structured-output schemas, context identifiers, and denied-network behavior?","rationale":"The verification artifact reports live smokes for `gpt-5.5` and `opus`, strict schema acceptance, and diagnostics improvements, but external CLI contracts are version-sensitive operational dependencies.","pushHarder":[{"id":"chg-008-ph1","prompt":"What happens if a supported CLI accepts the invocation but silently changes model alias behavior or reasoning semantics after installation?","rationale":"Capability profiles are meant to prevent silent downgrade, but aliases and provider behavior can drift outside static tests."}]},{"id":"chg-009","prompt":"How does the implementation preserve the Challenger’s complete primary and Push Harder question set through Defender/Publisher generation and final artifact validation?","rationale":"Verification reports structural comparison and exact finding-language preservation, but immutable questions are the core Whiteboard integrity property and need a precise explanation of what is compared.","pushHarder":[{"id":"chg-009-ph1","prompt":"What prevents the Challenger itself from producing shallow or off-scope questions that technically pass structural preservation?","rationale":"Structural immutability protects against Defender softening, but it may not prove substantive adversarial coverage."}]},{"id":"chg-010","prompt":"What does deterministic Whiteboard bundle validation prove about the generated HTML, manifest, stage outputs, receipts, evidence anchors, findings, and file digests?","rationale":"The verification artifact reports generated HTML parsing/execution, native reveals, visual checks, linked findings, and digest binding, but each check has a bounded semantic surface.","pushHarder":[{"id":"chg-010-ph1","prompt":"Which Whiteboard artifact defects are guaranteed to fail validation, and which weak-but-valid explanations could still pass because they are substantive-quality issues rather than deterministic contract violations?","rationale":"AC5 requires bad artifacts to fail while honestly disclosed implementation weaknesses can pass; the boundary is important."}]},{"id":"chg-011","prompt":"How close is the `linkedom-vm` generated-artifact validation to the real Desktop browser sandbox, and what browser/runtime behaviors does the verification evidence leave unproven?","rationale":"Verification distinguishes generated DOM validation from a narrow Electron smoke. That proves important mechanics but may not cover all production rendering, timing, viewport, or browser API differences.","pushHarder":[{"id":"chg-011-ph1","prompt":"If HTML passes `linkedom-vm` but fails only in Electron due to layout, CSS, or event-loop differences, where would that be observed before passage?","rationale":"The implementation relies on deterministic host validation plus representative browser smoke; their overlap and gap matter."}]},{"id":"chg-012","prompt":"How does the validator decide that a visual model is meaningful, evidence-linked, and accessible rather than merely present with an SVG role and text alternative?","rationale":"Verification claims accessible evidence-linked visuals, while the validator’s deterministic checks can prove presence, references, and text alternatives more easily than conceptual usefulness.","pushHarder":[{"id":"chg-012-ph1","prompt":"For a nontrivial feature like this one, what evidence proves the visual clarifies architecture, sequence, state, data flow, UI behavior, or debugging rather than serving as decoration?","rationale":"The